{
  "version": 1,
  "statusValues": [
    "implemented",
    "partial",
    "context target",
    "research target",
    "defer",
    "do not clone literally"
  ],
  "evidenceLabels": [
    "[OFFICIAL]",
    "[OPEN]",
    "[SYNTH]",
    "[IMPLEMENTED]"
  ],
  "items": [
    {
      "id": "web-shell",
      "category": "access-transport",
      "baselineCapability": "Browser access to the shell world.",
      "cyberscapeTarget": "Primary browser terminal and desktop shell backed by server-owned game state.",
      "status": "implemented",
      "evidence": ["[OFFICIAL]", "[IMPLEMENTED]"],
      "proof": ["packages/cyberscape/src/app", "packages/cyberscape/tests/acceptance.test.ts"],
      "nextAction": "Keep browser and plain-terminal behavior aligned as new shell capabilities land."
    },
    {
      "id": "plain-terminal",
      "category": "access-transport",
      "baselineCapability": "Terminal-first access model.",
      "cyberscapeTarget": "Plain text route for clients that should not depend on the rich desktop UI.",
      "status": "implemented",
      "evidence": ["[SYNTH]", "[IMPLEMENTED]"],
      "proof": ["packages/cyberscape/src/app/api/shell/plain/route.ts"],
      "nextAction": "Add focused parity tests when plain route behavior expands beyond shell posting."
    },
    {
      "id": "real-wire-protocols",
      "category": "access-transport",
      "baselineCapability": "External telnet, rlogin, SSH, FTP, Gopher, Finger, and QOTD services.",
      "cyberscapeTarget": "In-world command/protocol surfaces first; optional real protocol daemons later as adapters.",
      "status": "defer",
      "evidence": ["[OFFICIAL]", "[SYNTH]"],
      "proof": ["docs/knowledgebase/50-execution/cyberscape-feature-parity-roadmap.md"],
      "nextAction": "Do not add external daemons until web/API world state and security boundaries are stable."
    },
    {
      "id": "dialup-phone-loop",
      "category": "access-transport",
      "baselineCapability": "Phone-number and modem-era access before common LAN/Wi-Fi assumptions, including alternate lines and hunt groups.",
      "cyberscapeTarget": "In-world phone-number directory, executable acoustic-coupler attachment for pre-dial-up calls, persistent personal phonebook file with line type/protocol/notes, dial-up rows, modem/control-panel rows, wardial carrier and BBS/protocol hints, long-distance operator setup, calling-card toll ledger surfaces, BBS modem handoff, exact-number alternate-line dialing, line hunting, and a DIAL command that can connect, hit busy lines, fail with no carrier, or be toll-blocked.",
      "status": "implemented",
      "evidence": ["[SYNTH]", "[IMPLEMENTED]"],
      "proof": ["packages/cyberscape/src/lib/shell/engine.ts", "packages/cyberscape/src/components/terminal/Terminal.tsx", "packages/cyberscape/tests/acceptance.test.ts"],
      "nextAction": "Deepen alternate-number discovery with larger hunt groups, switchboard-style routing clues, and stronger wardial-to-owned-BBS file-area configuration."
    },
    {
      "id": "packet-pad-routing",
      "category": "access-transport",
      "baselineCapability": "Packet-switched host access before flat internet assumptions, including PAD/X.25 style traversal.",
      "cyberscapeTarget": "In-world PAD/X.25 shell verbs plus a TELEX packet-teleprinter endpoint that open packet circuits to visible multi-hop hosts, assign deterministic packet addresses, and surface those circuits through backend-derived connection, device, lineage, event, and receipt rows.",
      "status": "implemented",
      "evidence": ["[SYNTH]", "[IMPLEMENTED]"],
      "proof": ["packages/cyberscape/src/lib/shell/commands.ts", "packages/cyberscape/src/lib/shell/engine.ts", "packages/cyberscape/tests/acceptance.test.ts"],
      "nextAction": "Deepen packet-directory behavior with richer address books, switch families, and additional non-shell packet destinations beyond the first telex endpoint."
    },
    {
      "id": "remote-shell-stack",
      "category": "shell-ergonomics",
      "baselineCapability": "Connect to reachable hosts and return through shell/subsystem exits.",
      "cyberscapeTarget": "Current-host stack with telnet, ssh, rlogin, back, exit, and subsystem transitions.",
      "status": "implemented",
      "evidence": ["[OFFICIAL]", "[IMPLEMENTED]"],
      "proof": ["packages/cyberscape/src/lib/shell/engine.ts", "packages/cyberscape/tests/acceptance.test.ts"],
      "nextAction": "Audit prompt strings and remote-stack display against the canonical reference after new host modes land."
    },
    {
      "id": "pager-pipes-stty",
      "category": "shell-ergonomics",
      "baselineCapability": "Pager controls, pipe transforms, and STTY terminal modes.",
      "cyberscapeTarget": "Long-output navigation, searchable paging, command filtering, and dumb/TTY output shaping.",
      "status": "implemented",
      "evidence": ["[OFFICIAL]", "[IMPLEMENTED]"],
      "proof": ["packages/cyberscape/src/lib/shell/pager.ts", "packages/cyberscape/src/lib/shell/stty.ts", "packages/cyberscape/tests/acceptance.test.ts"],
      "nextAction": "Add client-level coverage for any future keyboard shortcuts or tab completion."
    },
    {
      "id": "tab-completion-controls",
      "category": "shell-ergonomics",
      "baselineCapability": "Tab completion and control-key shell behavior.",
      "cyberscapeTarget": "Browser/plain clients support completion and interruption semantics where practical.",
      "status": "context target",
      "evidence": ["[OFFICIAL]", "[SYNTH]"],
      "proof": ["data/raw/classic-network-manual.html.txt"],
      "nextAction": "Design client API for completion candidates and tests for completion/control behavior."
    },
    {
      "id": "command-corpus",
      "category": "command-corpus",
      "baselineCapability": "Official and live command families discoverable through HELP and community indexes.",
      "cyberscapeTarget": "Command matrix with source label, Cyberscape disposition, implementation file, and test proof.",
      "status": "partial",
      "evidence": ["[OFFICIAL]", "[OPEN]", "[IMPLEMENTED]"],
      "proof": ["packages/cyberscape/src/lib/shell/commands.ts", "docs/knowledgebase/50-execution/cyberscape-feature-parity-roadmap.md"],
      "nextAction": "Split command inventory into official-manual, live-verified, community-only, and Cyberscape-native groups."
    },
    {
      "id": "desktop-command-layer",
      "category": "command-corpus",
      "baselineCapability": "The command substrate exposes world state; Cyberscape adds Windows-era workstation metaphors.",
      "cyberscapeTarget": "Desktop commands stay backend-derived and reflect the same world state as text commands.",
      "status": "implemented",
      "evidence": ["[SYNTH]", "[IMPLEMENTED]"],
      "proof": ["packages/cyberscape/src/lib/shell/commands.ts", "packages/cyberscape/src/lib/shell/engine.ts", "packages/cyberscape/tests/acceptance.test.ts"],
      "nextAction": "Require backend-derived proof for every new desktop panel."
    },
    {
      "id": "host-graph",
      "category": "host-network",
      "baselineCapability": "Large historical host graph with adjacency, routing, and ownership markers.",
      "cyberscapeTarget": "Imported/generative graph with hero hosts, routes, services, login/root state, and honest source limits.",
      "status": "partial",
      "evidence": ["[OFFICIAL]", "[OPEN]", "[IMPLEMENTED]"],
      "proof": ["data/raw/np43-host-list.txt", "packages/cyberscape/src/lib/net/hosts.ts", "packages/cyberscape/src/lib/net/hero-hosts.ts"],
      "nextAction": "Improve provenance, generator rules, and service-specific depth."
    },
    {
      "id": "host-occupants-finger",
      "category": "host-network",
      "baselineCapability": "FINGER @host reveals historical or simulated occupants on remote hosts.",
      "cyberscapeTarget": "Host occupant archaeology model exposed through `finger @host`, with curated hero-host occupants and deterministic generated occupants for imported hosts.",
      "status": "partial",
      "evidence": ["[OFFICIAL]", "[SYNTH]", "[IMPLEMENTED]"],
      "proof": ["data/raw/classic-network-manual.html.txt", "packages/cyberscape/src/lib/net/hosts.ts", "packages/cyberscape/src/lib/net/hero-hosts.ts", "packages/cyberscape/src/lib/shell/engine.ts", "packages/cyberscape/tests/acceptance.test.ts"],
      "nextAction": "Add desktop/profile surfaces for host occupants and deepen provenance for generated occupant records."
    },
    {
      "id": "filesystem-archive",
      "category": "files-archives-bbs",
      "baselineCapability": "Host-local files, user writable storage, FTP retrieval, and historical archives.",
      "cyberscapeTarget": "Persistent host/user files, downloads, archive manifest assignments, provenance, and scoring.",
      "status": "partial",
      "evidence": ["[OFFICIAL]", "[OPEN]", "[SYNTH]", "[IMPLEMENTED]"],
      "proof": ["data/archive-manifest.json", "packages/cyberscape/src/lib/shell/engine.ts", "packages/cyberscape/tests/acceptance.test.ts"],
      "nextAction": "Expand reviewed archive corpus and add stronger quota/storage-pressure behavior."
    },
    {
      "id": "bbs-usenet-gopher",
      "category": "files-archives-bbs",
      "baselineCapability": "BBSes, USENET, Gopher, board messages, file libraries, and archive browsing.",
      "cyberscapeTarget": "BBS prompt, message boards, first sysop ownership claim, file areas, USENET reader/posting/search, and Gopher menu surfaces.",
      "status": "implemented",
      "evidence": ["[OFFICIAL]", "[OPEN]", "[IMPLEMENTED]"],
      "proof": ["packages/cyberscape/src/lib/bbs", "packages/cyberscape/tests/acceptance.test.ts"],
      "nextAction": "Deepen BBS from first sysop claim into moderation, player-created boards, and owned file-area configuration."
    },
    {
      "id": "bbs-sysop",
      "category": "files-archives-bbs",